title,author,rating,reviews_count,isbn10,price,company
Objective Economics (वस्तुनिष्ठ अर्थशास्त्र),by Sanjay Kumar,3.4,8,9350126672,135.0,Amazon
Mastering the Market Cycle: Getting the Odds on Your Side,by Howard Marks,4.1,15,1473680379,616.0,Amazon
Indian Economy,by Gaurav  Datt,3.6,48,9352531299,499.0,Amazon
EAD 15+1 cbse sample papers for class 12 Economics for 2019 examination,by Rachna Sagar,3.0,2,9387984532,189.0,Amazon
Xam Idea Economics Class 12 for 2019 Exam,by VK Global Publications Pvt. Ltd.,3.1,4,9387958477,390.0,Amazon
The Most Important Thing: Uncommon Sense for The Thoughtful Investor,by Howard Marks - Import,4.7,30,9353022797,238.0,Amazon
Capital (Das Kapital),by Karl Marx,4.5,48,8175994142,299.0,Amazon
India After Gandhi: The History of the World's Largest Democracy,by Ramachandra Guha,4.5,232,9382616977,477.0,Amazon
Advanced Economic Theory,by H L Ahuja,3.3,23,9352533321,655.0,Amazon
The Failure Project: The Story of Man's Greatest Fear,by Kochhar,4.1,8,9352015789,231.0,Amazon
Objective Civil Engineering,by P.K. Mishra,3.5,37,8174827986,103.0,Amazon
Children's Science Encyclopedia (Hindi): Familiarises Children with Important...,by A.H Hashmi,3.3,4,9381588813,413.0,Amazon
First Encyclopedia of Animals (Usborne First Encyclopedias),by Paul Dowswell,5.0,2,1409522423,455.0,Amazon
"Horoscope 2019: Your Complete Forecast, Pisces",by Bejan Daruwalla,4.348216833095578,0,9353024064,61.0,Amazon
Tarot Predictions 2019,by Karmel Nair - Import,5.0,11,9353020123,183.0,Amazon
"National Geographic Answer Book: 10,001 Fast Facts About Our World",by National Geographic,4.0,6,1426208928,750.0,Amazon
"Horoscope 2019: Your Complete Forecast, Scorpio",by Bejan Daruwalla,4.0,1,9353024226,74.0,Amazon
Quick General Knowledge 2018 with Current Affairs Update,by Disha Experts,3.4,90,9386323567,37.0,Amazon
5 Lb. Book of Gre Practice Problems (Manhattan Prep 5 lb Series),by Manhattan Prep,4.6,151,1506247598,1.0,Amazon
NEET Prep Guide 2019 with free Revision Points Booklet,by Arihant Expert,4.5,7,9313162539,685.0,Amazon
Legal Awareness and Legal Reasoning: For CLAT and Other Law Entrance Examinations...,by A. P. Bhardwaj,4.4,46,9352864964,412.0,Amazon
50 Successful Harvard Application Essays: What Worked for Them Can Help You Get...,by Harvard Crimson,5.0,4,1250127556,319.0,Amazon
"CISSP All-in-One Exam Guide, Eighth Edition",by Shon Harris - Import,3.7,11,1260142655,4.0,Amazon
Family Wisdom From The Monk Who Sold His Ferrari,by Robin Sharma,4.3,72,8179922308,214.0,Amazon
You are My Reason to Smile,by Arpit Vageria,4.4,470,9382665889,88.0,Amazon
Her Last Wish,by Ajay K. Pandey,4.7,1010,9382665870,88.0,Amazon
Peppa Pig: My Daddy,by Peppa Pig,4.1,19,1409309061,237.0,Amazon
Family Wisdom,by Robin Sharma,4.3,3,8184951914,166.0,Amazon
When Breath Becomes Air,by Paul Kalanithi,4.6,626,1847923674,332.0,Amazon
"Men are from Mars, Women are from Venus",by John Gray,4.4,427,8172235038,209.0,Amazon
Rich Dad Poor Dad (tamil),by Robert T Kiyosaki,4.5,361,8183223753,203.0,Amazon
What to Expect When You're Expecting,by Heidi Murkoff,4.4,71,1471147533,521.0,Amazon
Light on Yoga: The Classic Guide to Yoga by the World's Foremost Authority,by B.K.S. Iyengar,4.5,316,8172235011,298.0,Amazon
How to Talk So Kids Will Listen and Listen So Kids Will Talk,by Adele Faber,4.7,86,1848126328,255.0,Amazon
Tell Tale,by Jeffrey Archer,4.4,133,1509867767,269.0,Amazon
Ayurvediya Garbh Sanskar (Marathi),by Shree Balaji Tambe,4.5,408,9380571089,601.0,Amazon
Harry Potter and the Order of the Phoenix (Harry Potter 5),by J.K. Rowling,4.5,304,1408855690,599.0,Amazon
The Great Indian Diet,by Shilpa Shetty Kundra,4.0,380,8184007485,161.0,Amazon
One-Minute Super Dad: 99 Magic Moments to Raise Amazing Children,by Dr Prashant Jindal,4.6,44,9352774531,157.0,Amazon
Imagine: No Child Left Invisible,by Shelja Sen,4.8,9,9352773268,300.0,Amazon
The Ship of Secrets (Geronimo Stilton and the Kingdom of Fantasy #10),by Geronimo Stilton,4.8,151,9386313774,374.0,Amazon
Dharmayoddha Kalki: Avatar of Vishnu (Book 1),by Kevin Missal,4.2,226,8193503309,179.0,Amazon
Kingdom of Fantasy #6: The Search for Treasure (Geronimo Stilton - Kingdom of...,by Geronimo Stilton,4.6,162,9351033147,350.0,Amazon
Geronimo Stilton and the Kingdom of Fantasy #7: The Enchanted Charms,by Geronimo Stilton - Illustrated,4.7,182,9351035492,373.0,Amazon
Geronimo Stilton Se: The Journey through Time,by Geronimo Stilton,4.6,195,9351031934,371.0,Amazon
Geronimo Stilton Journey Through Time 3,by Geronimo Stilton - Import,4.7,87,9351037703,392.0,Amazon
The Priory of the Orange Tree,by Samantha Shannon,4.348216833095578,0,1526612860,524.0,Amazon
Harry Potter Aur Paras Patthar,by J.K. Rowling,4.7,115,8186775609,102.0,Amazon
The Blue Umbrella,by Ruskin Bond,4.4,350,8171673406,95.0,Amazon
The Last Avatar (Age of Kalki #1),by Vishwas Mudagal,4.2,17,9353024668,186.0,Amazon
Nursery Rhymes (My Jumbo Books),by Dreamland Publications,4.5,85,8184516207,140.0,Amazon
Nagargalin Ragayasam - The Secret of the Nagas (Tamil),by Amish Tripathi,4.5,147,9384030538,181.0,Amazon
Everyone Has A Story,by Savi Sharma,4.1,3372,9386036754,100.0,Amazon
Rabindranath Tagore - Selected Short Stories (Master's Collections),by Rabindranath Tagore,4.1,164,9380816049,86.0,Amazon
Be My Perfect Ending,by Arpit Vageria,4.4,204,9387022080,87.0,Amazon
She Friend - Zoned My Love,by Sudeep Nagarkar,4.6,248,9385990004,112.0,Amazon
Rumi A New Translation,by Farrukh Dhondy,4.1,67,9350290820,238.0,Amazon
A Hundred Little Flames,by Preeti Shenoy,4.7,426,9386850427,299.0,Amazon
The 3 Mistakes of My Life,by Chetan Bhagat,4.3,615,8129135515,101.0,Amazon
One Night @ The Call Centre,by Chetan Bhagat,4.0,595,8129135507,106.0,Amazon
21 Anmol Kahaniyaa (Premchand),by Premchand,4.5,85,9350336618,119.0,Amazon
War & Peace,by Leo Tolstoy,4.3,103,8175992832,279.0,Amazon
Masterpieces of World Fiction: Selected Stories By  LEO TOLSTOY,by LEO TOLSTOY,4.4,9,8129131498,140.0,Amazon
Think and Grow Rich,by Napoleon Hill,4.6,3611,9350330954,166.0,Amazon
Little Women,by Louisa May Alcott,4.3,136,8175992905,169.0,Amazon
It's All in the Planets,by Preeti Shenoy,4.3,403,9386036452,167.0,Amazon
Dracula,by Bram Stoker,4.2,156,8172344775,99.0,Amazon
Mistress of the Throne: The Mughal Intrigues,by Ruchir Gupta,4.1,71,9382665072,150.0,Amazon
No Matter What I Do: I end up Falling for You,by Devanshi Sharma,4.2,216,9382665846,88.0,Amazon
The Right Time,by Danielle Steel,3.6,4,1509881336,211.0,Amazon
Chanakya's Chant: Book 2 in the Bharat Series of Historical and Mythological...,by Ashwin Sanghi,4.1,585,9381626812,244.0,Amazon
Shivagami Kadha  Bahubali  Bhagam 1: The Rise Of Sivagami Telugu,by Anand Neelakantan,3.6,28,9386224607,255.0,Amazon
Poonachi: Or the Story of a Black Goat,by Perumal Murugan,4.5,121,9386850494,114.0,Amazon
Nothing Lasts Forever,by Vish Dhamija,3.9,254,9380349246,105.0,Amazon
The Dramatic Decade: The Indira Gandhi Years,by Pranab Mukherjee,3.7,225,8129135744,199.0,Amazon
The Secret,by Rhonda Byrne,4.5,1610,1471172392,538.0,Amazon
In the Blink of An Eye: 2nd Edition,by Walter Murch,4.3,28,1879505622,829.0,Amazon
Our Films Their Films (Disha),by Ray,4.7,14,8125015655,371.0,Amazon
Deep Focus: Reflections on Cinema,by Satyajit Ray,4.5,30,9351360016,188.0,Amazon
I am The Mind,by Deep Trivedi,4.1,172,9384850098,236.0,Amazon
The Pather Panchali Sketchbook,by Satyajit Ray,4.9,21,9351779335,874.0,Amazon
General Knowledge Aptitude and Logical Thinking for AIIMS,by Sunil Nain,4.5,57,9387351416,116.0,Amazon
AIIMS General Knowledge with Logical Thinking with Monthly Current Affairs Update...,by Disha Experts,3.8,19,9386629771,120.0,Amazon
Know Your State - Himachal Pradesh,by Arihant Experts,4.1,16,9350947900,185.0,Amazon
Banking Awareness for SBI & IBPS Bank Clerk/PO/RRB/RBI Exams,by Disha Experts,4.5,6,9388240944,147.0,Amazon
"CDS 12 Years Topic-wise Solved Papers Mathematics, English & General Knowledge...",by Disha Experts,3.8,10,9387421627,363.0,Amazon
Lucents Samanya Hindi : Pratiyogi Parikshaon Ke Leye,by .,4.2,33,9384761168,190.0,Amazon
Madhya Pradesh General Knowledge - At A Glance,by C.L. Khanna,3.3,9,9350132389,85.0,Amazon
Relativity: The Special and the General Theory (General Press),by Albert Einstein,4.4,430,9380914229,146.0,Amazon
The Wellness Sense: A Practical Guide to your Physical and Emotional Health Based...,by Om Swami,4.8,334,9351772624,178.0,Amazon
Indian Superfoods: Change the Way You Eat,by Rujuta Diwekar,4.1,305,8193237234,269.0,Amazon
A Taste of Well-Being: Sadhguru's Insights for Your Gastronomics,by Isha Foundation,4.3,180,9351363783,172.0,Amazon
You Can Heal Your Life,by Louise L. Hay,4.6,562,8190565583,252.0,Amazon
The Heartfulness Way: Heart-Based Meditations for Spiritual Transformation,by Kamlesh D. Patel,4.9,605,9386850567,189.0,Amazon
Eat Delete Junior: Child Nutrition for Zero to Fifteen Years,by Pooja Makhija,3.8,24,9352644875,239.0,Amazon
Mudras & Health Perspectives: An Indian Approach: 12 New Mudras including Kubera...,by Suman K. Chiplunkar,4.4,78,8190587447,299.0,Amazon
"Prevent and Reverse Heart Disease: The Revolutionary, Scientifically Proven,...",by Caldwell B. Esselstyn Jr. M.D.,4.3,25,1583333002,499.0,Amazon
Ageless: A Yogi's Secrets To A Long And Healthy Life,by Sharath Jois,5.0,2,8193876784,193.0,Amazon
"Textbook of Anatomy: Head, Neck and Brain - Vol.3",by Vishram Singh,5.0,1,8131252914,582.0,Amazon
13 Steps to Bloody Good Luck,by Ashwin Sanghi,4.1,522,9384030570,90.0,Amazon
You Can Win: A step by step tool for top achievers,by Shiv Khera,4.6,770,9382951717,232.0,Amazon
"The Biology of Belief: Unleashing the Power of Consciousness, Matter and Miracles",by Bruce Lipton,4.4,199,9380480016,210.0,Amazon
Light on Pranayama,by B.K.S. Iyengar,4.3,70,8172235410,248.0,Amazon
"Let's Talk Money: You've Worked Hard for It, Now Make It Work for You",by Monika Halan,4.5,85,9352779398,367.0,Amazon
The Power of Now: A Guide to Spiritual Enlightenment,by Eckhart Tolle,4.5,457,8190105914,250.0,Amazon
Textbook of Clinical Neuroanatomy,by Vishram Singh,4.8,12,8131244644,542.0,Amazon
Adiyogi: The Source of Yoga,by Sadhguru,4.6,376,9352643925,178.0,Amazon
Right Parenting: New Age Parenting and Child-Health Handbook,by Mandar V. Bichu,5.0,1,8179918564,370.0,Amazon
Ancient and Medieval India,by Poonam Dalal Dahiya,4.5,330,9352603451,342.0,Amazon
A History of Medieval India,by Chandra Satish,4.1,437,8125032266,269.0,Amazon
A History of Ancient and Early Medieval India: From the Stone Age to the 12th...,by Upinder Singh,4.4,247,8131716775,504.0,Amazon
World History,by Krishna Reddy,4.1,43,9387067556,238.0,Amazon
Homo Deus: A Brief History of Tomorrow,by Yuval Noah Harari,4.5,304,1784703931,344.0,Amazon
Modern Indian History: For Civil Services Preliminary and Main Examinations,by Sonali Bansal,4.4,94,9353160235,473.0,Amazon
"India's Wars: A Military History, 1947-1971",by Arjun Subramaniam,4.5,38,9351777499,415.0,Amazon
"Madhyakaleen Bharat Rajniti, Samaj Aur Sanskr",by Chandra Satish,4.3,154,8125032487,202.0,Amazon
Why I Am a Hindu,by Dr. Shashi Tharoor,3.4,259,9386021102,299.0,Amazon
Assam: From Yandabo to Partition,by Priyam Goswami,4.0,26,8125046534,270.0,Amazon
University of Delhi (DU) MA History Entrance Exam Guide,by RPH Editorial Board,4.0,8,9350128268,182.0,Amazon
Adhunik Bharat Ka Itihas,by Bipan Chandra,4.3,361,8125036814,192.0,Amazon
Prarambhik Bharat Ka Parichay,by Ram Sharan Shar,4.5,132,8125026517,202.0,Amazon
A Brief History Of Modern India (Old edition),by Rajiv Ahir,4.0,502,8179306127,195.0,Amazon
A History of Political Thought: Plato to Marx,by Mukherjee,3.7,68,8120343891,329.0,Amazon
An Introduction to the Study of Indian History,by Damodar Dharmanand Kosambi,4.4,12,9386042215,300.0,Amazon
History of Medieval India,by V D Mahajan,3.9,11,8121903645,364.0,Amazon
Adhunik Bharat KA Itihas आधुनिक भारत का इतिहास,by Rajiv Ahir,4.3,50,8179306895,235.0,Amazon
Geography of India,by Majid Husain,4.1,227,9352606221,460.0,Amazon
Bake with Shivesh,by Shivesh Bhatia,4.6,14,9353023114,559.0,Amazon
A Dog's Way Home: The Heartwarming Story of the Special Bond Between Man and...,by W. Bruce Cameron,5.0,4,1509855947,399.0,Amazon
Home Gardeners’ Guide Indian Garden Flowers,by Amarjeet Singh Batth,3.4,7,8175994029,399.0,Amazon
It,by Stephen King,4.4,113,1444707868,224.0,Amazon
Upon an Old Wall Dreaming: More of My Favourite Stories and Sketches,by Ruskin Bond,4.9,9,9384067474,240.0,Amazon
That Frequent Visitor: Every Face has a darker side,by K. Hari Kumar,3.7,121,9382665307,93.0,Amazon
The Ruskin Bond Horror Omnibus,by Ruskin Bond,4.0,7,8129112558,395.0,Amazon
Bhoy Rohosyo 101 [Horror Story] (Bengali),by Trideb Kumar Chatterjee & Subhasish Ghosh,4.5,4,8183741916,440.0,Amazon
Elevation,by Stephen King,3.4,6,1473691524,309.0,Amazon
The Hitchhiker's Guide to the Galaxy Omnibus: A Trilogy in Five Parts (Hitchhikers...,by Douglas Adams,4.1,154,1509852794,510.0,Amazon
Autobiography of a Yogi (Complete Edition),by Paramahansa Yogananda - Illustrated,4.6,1265,8190256203,179.0,Amazon
My Gita,by Devdutt Pattanaik - Special Edition,4.2,686,8129137704,153.0,Amazon
Dilli Darbaar,by Satya Vyas,4.2,158,9386224194,107.0,Amazon
What If?,by Randall Munroe - Kindle eBook,4.4,195,1848549563,291.0,Amazon
Tom Gates Book: Absolutely Fantastic,by Tom Gates,4.7,27,9351033031,194.0,Amazon
A Horse Walks into a Bar (Winner of the International Man Booker Prize 2017),by David Grossman,4.0,39,1784704229,263.0,Amazon
Tom Gates Book #4: Genius Ideas,by Tom Gates,4.4,55,9351033023,257.0,Amazon
Rag Darbari,by Shrilal Shukla,4.5,141,8126713968,200.0,Amazon
Eleventh Hour,by S. Hussain Zaidi,4.0,50,9352779290,160.0,Amazon
The Concise 48 Laws Of Power (The Robert Greene Collection),by Robert Greene,4.2,62,1861974043,283.0,Amazon
Geronimo Stilton #63? the Cheese Experiment,by Geronimo Stilton,4.3,41,9385887351,161.0,Amazon
Homo Deus (Special Collector’s Editions in Full Colour): A Brief History of Tomorrow,by Yuval Noah Harari,4.5,304,1910701882,300.0,Amazon
One Life to Ride: A Motorcycle Journey to the High Himalayas,by Ajit Harisinghani,4.7,99,8175992948,189.0,Amazon
Job Be Damned: Work Less. Career Success.,by Rishi Piparaiya,4.0,31,9352777670,161.0,Amazon
Indian Navy Secondary SSR Guide 2018,by Arihant Experts,4.0,24,9312148885,138.0,Amazon
An Introduction to Indian Philosophy,by Satishchandra Chatterjee,4.4,91,8129111950,106.0,Amazon
Indian Coast Guard Navik General Duty Guide 2018,by Arihant Experts,4.8,6,9312148907,202.0,Amazon
Indian Polity (Telugu Version),by M. Laxmikanth,4.2,75,9385880160,599.0,Amazon
Objective Indian Polity: General Studies - Paper I,by M. Laxmikanth,4.1,116,9339220838,276.0,Amazon
The Book of Indian Dogs,by S. Theodore Baskaran - Import,3.6,57,9384067571,394.0,Amazon
Indian Mammals: A Field Guide,by Vivek Menon,4.8,159,9350097605,775.0,Amazon
Indian Air Force Airman Group 'Y' (Non-Technical Trades),by Arihant Experts,3.9,26,9311126691,165.0,Amazon
It Happens for a Reason,by Preeti Shenoy,4.2,394,9384030740,189.0,Amazon
Bhartiya Nausena Senior Secondary (SSR),by Arihant Experts,4.6,3,9311126780,203.0,Amazon
Banaras Talkies,by Satya Vyas,4.5,370,9381394997,87.0,Amazon
Half Girlfriend,by Chetan Bhagat,4.2,6566,8129135728,106.0,Amazon
integration of the Indian States,by V.P. Menon,4.6,34,8125054510,720.0,Amazon
Never Kiss your Best Friend,by Sumrit Shahi - Import,4.4,108,8129134853,101.0,Amazon
Note by Note: The India Story 1947-2017,by A. Bhardwaj - Import,4.8,12,9352770102,269.0,Amazon
Simply South : Traditional Vegetarian Cooking,by Chandra Padmanabhan,4.4,9,8189975749,237.0,Amazon
An Indian Spy in Pakistan,by Mohanlal Bhaskar,4.2,147,8188575194,295.0,Amazon
Legal Eagles: Stories of the Top Seven Indian Lawyers,by Indu Bhan,3.9,70,8184006357,310.0,Amazon
India 2018: A Reference Annual,by Publication Division,3.8,160,8123027389,333.0,Amazon
Pathfinder for NDA & NA National Defence Academy Naval Academy Entrance Examination,by Arihant Experts,4.3,176,9312146734,572.0,Amazon
You’re the Password to My Life,by Sudeep Nagarkar,4.2,447,8184005849,102.0,Amazon
.NET: Interview Questions,by Shivprasad Koirala,4.1,142,8183331475,300.0,Amazon
SQL Server Interview Questions,by Shiv Prasad Koirala,3.3,18,8183331033,282.0,Amazon
Unix Shell Programming,by Yashavant P. Kanetkar,3.8,45,8170297532,282.0,Amazon
Law of Torts With Consumer Protection Act,by RK Bangia,4.2,22,8189530917,434.0,Amazon
The Seven Spiritual Laws of Success: A Pocket Guide to Fulfilling Your Dreams,by Deepak Chopra M.D.,4.4,211,8189988042,189.0,Amazon
The Law of Success: In Sixteen Lessons (General Press),by Napoleon Hill,4.4,150,8180320928,371.0,Amazon
The 48 Laws Of Power (The Robert Greene Collection),by Robert Greene,4.4,137,1861972784,643.0,Amazon
The 7 Laws of Clearing CA Final,by Nitin Soni,4.5,53,9350712539,119.0,Amazon
The Laws of the Spirit World (Now In Hindi),by Khorshed Bhavnagri,4.6,99,8184952589,284.0,Amazon
Self Study Guide CLAT (Common Law Admission Test) 2019,by Arihant Experts,3.6,4,9313165317,405.0,Amazon
The Law of Attraction,by Jerry Hicks,4.4,32,8189988158,261.0,Amazon
The Code of the Extraordinary Mind: 10 Unconventional Laws to Redefine Your Life...,by Vishen Lakhiani,4.5,60,1623367581,431.0,Amazon
Basic Laws of Electromagnetism,by IE IRODOV,3.9,57,9350943182,72.0,Amazon
The Essence of Law of Success (Hindi),by N Hil,4.4,8,8184955561,143.0,Amazon
The Key to Living the Law of Attraction: The Secret to Creating the Life of Your...,by Jack Canfield,4.7,11,1409151638,228.0,Amazon
"Criminal Manual: Cr.P.C., I.P.C. and Evidence 2018",by Universal's Legal Manual (Pocket Size),4.1,49,8175349190,330.0,Amazon
Introduction to Information Security and Cyber Laws,by Surya Prakash Tripathi,1.0,1,9351194736,332.0,Amazon
The Essence of Law of Success,by Napoleon Hill,4.348216833095578,0,8184954336,140.0,Amazon
Rahasya,by Rhonda Byrne,4.6,870,8183220940,233.0,Amazon
Sidharth,by Hermann Hesse,4.3,69,9350642344,104.0,Amazon
All  in One English Communicative CBSE Class 10  (based on textbook Literature...,by Gajendra Singh,4.5,157,9312149547,235.0,Amazon
CBSE All  In One English Language and Literature CBSE Class 9 (based on Books...,by Gajendra Singh,4.3,56,9312149431,234.0,Amazon
An Outline History of English Literature,by William Henry Hudson,4.1,34,8129135396,113.0,Amazon
A Background to the study of English Literature: Revised Edition,by Brijadish Prasad,3.8,18,9351380424,175.0,Amazon
Lokpriya Shayar Aur Unki Shayari: Sahir Ludhianavi,by Prakash Pandit,4.4,41,9350641984,100.0,Amazon
Ruskin Bond Ki Lokpriya Kahaniyan,by Ruskin Bond,3.6,9,9351865517,150.0,Amazon
The Fifth Mountain,by Paulo Coelho,4.4,36,8172235143,224.0,Amazon
Oswaal ISC Question Bank Class 12 English Papers 2 Literature Chapterwise and...,by Oswaal Editorial Board,4.1,7,9387504999,169.0,Amazon
Yayati (Hindi),by Vishnu S. Khandekar,4.1,55,8170285593,178.0,Amazon
"My Hero Academia, Vol. 1",by Kohei Horikoshi,4.9,15,1421582694,499.0,Amazon
The Hunt for the Secret Papyrus (Geronimo Stilton),by Geronimo Stilton - Import,4.6,82,9385887750,328.0,Amazon
Geronimo Stilton Se: The Hunt for the 100th Key,by Geronimo Stilton,4.5,100,9386313219,413.0,Amazon
A Case of Exploding Mangoes,by Mohammed Hanif,3.7,24,8184001894,255.0,Amazon
Thea Stilton #23: Thea Stilton and the Hollywood Hoax,by Thea Stilton,4.3,45,9386041138,260.0,Amazon
Geronimo Stilton #65 the Bollywood Burglary,by Geronimo Stilton,4.3,145,9386313162,350.0,Amazon
All In One Science - Class 10 (2018-19 Session),by Arihant Experts,4.4,188,9312149601,298.0,Amazon
Oswaal CBSE Question Bank Class 9 Science Chapterwise and Topicwise (For March...,by Oswaal Editorial Board,4.6,53,9387504832,295.0,Amazon
ESSAYS for Civil Services and Other Competitive Examinations,by Pulkit Khare,3.9,167,9351410226,65.0,Amazon
Together with CBSE/NCERT Practice Material Chapterwise for Class 10 Social Science...,by Namrata Singh,3.8,26,9387672662,329.0,Amazon
Hero (Secret (Rhonda Byrne)),by Rhonda Byrne,4.4,85,1471133443,639.0,Amazon
Internal Security for Civil Services Main (GS paper III) by Pearson,by M. Karthikeyan,4.5,53,9332587353,148.0,Amazon
Gazing at Neighbours: Travels Along the Line That Partitioned India,by Bishwanath Ghosh,4.5,32,9386224984,195.0,Amazon
Together with CBSE/NCERT Practice Material Chapterwise for Class 12 Chemistry...,by R. P. Manchanda,3.4,9,9387672417,349.0,Amazon
Self-Assessment & Review Medicine (Part A & B) (PGMEE),by Mudit Khanna,3.3,16,9352704339,1.0,Amazon
The Essentials of Forensic Medicine and Toxicology,by K.S. Narayan Reddy,4.5,19,9352701038,467.0,Amazon
Review of Pharmacology (PGMEE),by Gobind Rai Garg,4.4,35,9352704177,640.0,Amazon
What Your Doctor Doesn'T Know About Nutritional Medicine May beKilling You,by Ray D. Strand. M.D.,4.1,23,8183221629,150.0,Amazon
Kya Apka Doctor Poshak Tatvon Ke Bare Mein Jantaa Hai,by Ray D. Strand,4.2,56,8182742757,185.0,Amazon
SRB’s Manual of Surgery,by Sriram Bhat M,3.9,33,9351524167,1.0,Amazon
Diabetes Type 1 & 2: 72 Ghanton Mai Rogmukt,by Biswaroop Roy Choudhray,3.4,74,9351656233,143.0,Amazon
If Truth Be Told: A Monk's Memoir,by Om Swami,4.7,527,9351368068,311.0,Amazon
Gene Machine: The Race to Decipher the Secrets of the Ribosome,by Venki Ramakrishnan,4.9,13,9353023238,436.0,Amazon
The Man Who Mistook His Wife for a Hat: Picador Classic,by Oliver Sacks,4.3,35,1447275403,311.0,Amazon
An Astronaut's Guide to Life on Earth,by Chris Hadfield - Unabridged,4.6,36,1447257510,324.0,Amazon
Mothering A Muslim,by Nazia Erum,4.348216833095578,0,8193876717,162.0,Amazon
Eat Pray Love: One Woman's Search for Everything,by Elizabeth Gilbert,4.2,65,1408844486,364.0,Amazon
I Too had a Dream,by Verghese Kurien,4.7,123,8174364072,295.0,Amazon
One Life is not Enough: An Autobiography,by K. Natwar Singh,3.9,126,8129132745,225.0,Amazon
Driven: The Virat Kohli Story,by Vijay Lokapally,4.4,81,9385936263,299.0,Amazon
If I Had to Tell It Again: A Memoir,by Gayathri Prabhu,4.5,21,9352773756,218.0,Amazon
My Country My Life,by L.K. Advani,4.5,14,8129116545,298.0,Amazon
Not Just an Accountant: The Diary of the Nations Conscience Keeper,by Vinod Rai,4.5,196,8129134616,378.0,Amazon
Living With the Himalayan Masters,by Swami Rama,4.9,18,8183222714,232.0,Amazon
Thea Stilton Mouseford Academy #8: A Fashionable Mystery,by Thea Stilton,4.4,38,8184778546,167.0,Amazon
The Krishna Key: Book 3 in the Bharat Series of Historical and Mythological Thrillers,by Ashwin Sanghi,4.1,636,9381626685,230.0,Amazon
The Mahabharata Quest: The Alexander Secret,by Christopher C. Doyle,3.8,511,9384030597,186.0,Amazon
The Reckoning,by John Grisham,3.2,15,1473684587,247.0,Amazon
The Three Secret Cities (Jack West Series),by Matthew Reilly,4.4,18,1409167178,388.0,Amazon
A Murder in Gurgaon,by Manish Dubey,3.9,69,9382665781,106.0,Amazon
Harry Potter and the Half Blood Prince,by J.K. Rowling,4.6,246,1408855704,628.0,Amazon
"Marry Me, Stranger",by Novoneel Chakraborty,4.4,410,8184005962,112.0,Amazon
The Power of Your Subconscious Mind,by Joseph Murphy,4.5,5009,8183224008,159.0,Amazon
Principles: Life and Work,by Ray Dalio,4.4,87,1501124021,864.0,Amazon
Note to Self,by Connor Franta,4.5,53,1471163571,490.0,Amazon
"Plague, Fall, Exile And The Kingdom And Selected Essays (Everyman's Library Contemporar)",by Albert Camus,4.6,23,1857152786,629.0,Amazon
India Now and in Transition,by Atul K. Thakur,5.0,1,9385285637,369.0,Amazon
Indian Political Thought,by Himanshu Roy,4.0,22,9332587337,230.0,Amazon
"The Spy Chronicles: RAW, ISI and the Illusion of Peace",by A.S. Dulat - Illustrated,3.5,121,9352779258,477.0,Amazon
Ishq Mein Shahar Hona ( Volume 1 of Laprek Trilogy),by Ravish Kumar,4.0,308,8126727675,119.0,Amazon
Political Theory Textbook for Class - 11  - 11117,by NCERT,3.8,24,8174506136,70.0,Amazon
Ashvamedha: The Game of Power,by Aparna Sinha,4.2,224,9382665765,195.0,Amazon
15 Sample Question Political Science Class 12th CBSE,by Arihant Experts,5.0,1,9313166127,113.0,Amazon
Physics for Class 10 (2019 Exam),by Lakhmir Singh,4.3,57,9352831802,320.0,Amazon
Handbook of Physics,by Nipendra Bhatnagar,4.4,403,9352036034,189.0,Amazon
CBSE All  In One Mathematics CBSE Class 10 for 2018 - 19,by Arihant Experts,4.5,81,9312149598,234.0,Amazon
10 Years Solved Papers: ICSE Class 10 for 2019 Examination,by Gurukul Books,4.6,115,8193550714,678.0,Amazon
Chemistry for Class 10 (2019 Exam),by Lakhmir Singh,4.2,81,9352831810,381.0,Amazon
Oswaal CBSE Question Bank Class 10 English Communicative Chapterwise and Topicwise...,by Oswaal Editorial Board,4.3,91,9387504905,247.0,Amazon
Microsoft Excel 2016 Bible: The Comprehensive Tutorial Resource,by John Walkenbach,3.9,49,8126558946,833.0,Amazon
Exploring Biology for NEET - Vol. 1,by Sanjay Sharma,4.4,21,9312146998,525.0,Amazon
CBSE All  In One Science CBSE Class 9 for 2018 - 19,by Arihant Experts,4.6,66,9312149687,230.0,Amazon
CBSE Biology Chapterwise Solved Papers Class 12th,by Arihant Expert,4.3,38,9313161400,150.0,Amazon
CBSE All  in One Chemistry CBSE Class 12 for 2018 - 19,by Indu Gupta,4.4,46,9312149008,260.0,Amazon
Concept of Physics Part-2 (2018-2019 Session) by H.C Verma,by H.C. Verma,4.5,711,8177092324,267.0,Amazon
Concept of Physics Part-1 (2018-2019 Session) by H.C Verma,by H.C. Verma,4.6,963,8177091875,267.0,Amazon
CBSE All  in One BIOLOGY CBSE Class 12 for 2018 - 19,by Hema Batra,4.0,20,9312149024,241.0,Amazon
CBSE NCERT Solutions Physics Class 11  for 2018 - 19,by Nipendra Bhatnagar,4.0,89,9351416348,166.0,Amazon
Handbook of Chemistry,by R P Singh,4.3,369,9352036042,154.0,Amazon
Mechanical Engineering: Conventional and Objective Types (2018-19 Session),by R.S. Khurmi,4.0,603,8121906288,430.0,Amazon
How to Crack Test Of Reasoning,by Jaikishan,5.0,3,9313166755,142.0,Amazon
