title,author,rating,reviews_count,isbn10,price,company
Tell Me your Dreams,by Sidney Sheldon,4.4,160,8172234902,209.0,Amazon
The Boy in the Striped Pyjamas (Definitions),by John Boyne,4.6,134,1862305277,350.0,Amazon
"Romancing the Balance Sheet: For Anyone Who Owns, Runs or Manages a Business",by Anil Lamba,4.5,156,9350294311,477.0,Amazon
Mossad,by Michael Bar-Zohar - Import,4.6,637,8184958455,340.0,Amazon
My Story,by Kamala Das,4.5,42,8172238975,178.0,Amazon
Inspiring Thoughts (Inspiring Thoughts Quotation Series),by A.P.J. Abdul Kalam,4.1,148,8170286840,120.0,Amazon
12 Years a Slave,by Solomon Northup,4.5,41,8175994479,99.0,Amazon
Headley And I,by S. Hussain Zaidi,3.5,14,9350295725,247.0,Amazon
Making India Awesome: New Essays and Columns,by Chetan Bhagat,3.8,1188,8129137429,100.0,Amazon
The Dirty Dozen: Hitmen of the Mumbai Underworld,by Gabriel Khan,4.2,54,9386850133,221.0,Amazon
Commando,by Michael Bar-Zohar,3.7,15,9386867168,333.0,Amazon
"Behold, I Shine: Narratives of Kashmir's Women and Children",by Freny Manecksha - Import,4.3,15,8129145715,106.0,Amazon
Corporate Guru Narayan Murthy,by N Chokkan,4.1,4,8173157685,150.0,Amazon
Byculla to Bangkok,by S. Hussain Zaidi,4.1,96,9351362256,192.0,Amazon
"Who Cheats and How?: Scams, Frauds and the Dark Side of the Corporate World:...",by Robin Banerjee,3.5,17,9351500616,360.0,Amazon
Little Black Book for Stunning Success + Tools for Action Mastery,by Robin Sharma,4.4,67,8184959893,220.0,Amazon
The Book Thief (Definitions Young Adult),by Markus Zusak,4.5,87,1909531618,379.0,Amazon
Refreshing Mandala - Colouring Book for Adults Book 3,by Dreamland Publications,4.4,36,9350899175,175.0,Amazon
Rejuvenate Yourself - Floral Patterns,by Dreamland Publications,4.3,59,9350899477,140.0,Amazon
This Is Not Your Story,by Savi Sharma,4.5,2177,9386224399,100.0,Amazon
IQ Tests Book-1 - Boost Your Intelligence,by Arihant Experts,3.8,19,9350945746,86.0,Amazon
The Perks of Being a Wallflower,by Stephen Chbosky,4.4,306,1451696191,186.0,Amazon
Great Stories for Children,by Ruskin Bond,4.4,217,8129118920,182.0,Amazon
Creative Doodle Colouring - Animals & Birds,by Dreamland Publications,4.7,11,9350897954,140.0,Amazon
"Coloring Mandalas 2: For Balance, Harmony, and Spiritual Well-Being (An Adult...",by Susanne F. Fincher,3.9,2,1590300866,610.0,Amazon
Sita: Warrior of Mithila (Ram Chandra),by Amish Tripathi,4.3,1817,9386224585,226.0,Amazon
How to Be an Adult in Relationships: The Five Keys to Mindful Loving,by David Richo,5.0,1,1570628122,689.0,Amazon
Eleven Minutes,by Paulo Coelho,4.2,234,8172235631,167.0,Amazon
The Animal Book: A Visual Encyclopedia of Life on Earth (Reference),by DK,4.8,19,1409323498,781.0,Amazon
The Power of Your Subconscious Mind: Unlock Your Master Key to Success,by Joseph Murphy,4.5,5009,8172345666,75.0,Amazon
Ram - Scion of Ikshvaku (Book 1 - Ram Chandra Series): 2015 Edition with Updated...,by Amish Tripathi,4.1,4651,9385152149,240.0,Amazon
The Rise of Sivagami: Book 1 of Baahubali - Before the Beginning,by Anand Neelakantan,4.1,793,9386224445,162.0,Amazon
Murder in a Minute,by Shouvik Bhattacharya,4.4,277,9386643723,188.0,Amazon
Alice’s Adventures in Wonderland,by Lewis Carroll,4.0,119,8175992980,89.0,Amazon
Harappa - Curse of the Blood River,by Vineet Bajpai,4.1,680,9352685482,185.0,Amazon
Harry Potter and the Philosopher's Stone,by J.K. Rowling,4.7,1097,1408855658,299.0,Amazon
Geronimo Stilton and the Kingdom of Fantasy #8 - The Hour of Magic,by Geronimo Stilton,4.6,329,9385887815,274.0,Amazon
The Dragon of Fortune (Geronimo Stilton and the Kingdom of Fantasy: Special Edition...,by Geronimo Stilton,4.6,285,9352751183,510.0,Amazon
The Crab with Golden Claws (Tintin),by Herge,4.7,29,1405206209,279.0,Amazon
Suppandi - 3: The Laughter Never Ends,by Rajani Thindiath,4.7,59,9350853736,76.0,Amazon
The adventures of Tintin: King Ottokar's Sceptre,by Herge,4.6,32,1405206195,379.0,Amazon
Circe: The Sunday Times Bestseller,by Madeline Miller,4.3,47,1526603330,364.0,Amazon
Bloodline,by Sidney Sheldon,4.3,67,8172234864,280.0,Amazon
Geronimo Stilton #58: The Super Chef Contest,by Geronimo Stilton,4.2,66,9351033287,186.0,Amazon
The Jungle Book (First Stories),by Miriam Bos,4.4,71,1509808361,224.0,Amazon
Peppa Pig: Amazing Adventures Sticker Book,by NA,4.8,11,1409312135,194.0,Amazon
Swami and Friends,by R. K. Narayan,4.6,204,8185986002,114.0,Amazon
The Secret Of The Nagas (Shiva Trilogy-2),by Amish Tripathi - Abridged,4.6,1681,9381626340,244.0,Amazon
The Oath of the Vayuputras (Shiva Trilogy),by Amish Tripathi,4.4,1608,9382618341,282.0,Amazon
Fantastic Beasts: The Crimes of Grindelwald: The Original Screenplay (Fantastic...,by J.K. Rowling,4.8,52,1408711702,434.0,Amazon
The Adventures of Tintin Volume 1,by Herge,3.7,9,1405282754,784.0,Amazon
Harry Potter and the Chamber of Secrets (Harry Potter 2),by J.K. Rowling,4.7,562,1408855666,374.0,Amazon
Keepers of the Kalachakra: Book 5 in the Bharat Series of Historical and Mythological...,by Ashwin Sanghi,4.0,472,9386850648,100.0,Amazon
Harry Potter and the Prisoner of Azkaban (Harry Potter 3),by J.K. Rowling,4.4,474,1408855674,374.0,Amazon
Geronimo Stilton - The Hunt for the Golden Book,by Geronimo Stilton - Large Print,4.4,179,9351032167,319.0,Amazon
Norse Mythology,by Neil Gaiman,4.4,108,1526602067,299.0,Amazon
The Secret of the Druids (Mahabharata Quest Series Book 2),by Christopher C. Doyle,4.1,273,9385724223,179.0,Amazon
Indian Art and Culture,by Nitin Singhania,4.5,391,9387067548,412.0,Amazon
Bharatiya Kala Evam Sanskriti,by Nitin Singhania,4.6,128,9387067718,370.0,Amazon
The Art of War,by Sun Tzu,4.3,76,8184950888,175.0,Amazon
ICSE Art of Effective English Writing for Classes IX - X,by O P Singh,4.6,20,9352534751,316.0,Amazon
Trump: The Art of the Deal,by Donald Trump,4.0,51,1784758248,320.0,Amazon
All you need is Love: The art of mindful parenting,by Shelja Sen,4.3,36,9351770729,225.0,Amazon
The Bachelor of Arts,by R. K. Narayan,4.4,31,8185986010,90.0,Amazon
"Ready, Study, Go!: Smart Ways to Learn",by Khurshed Batliwala,4.5,444,9352641345,178.0,Amazon
The Art of Living,by Thich Nhat Hanh,4.5,2,1846045096,434.0,Amazon
Gurudev: On the Plateau of the Peak: The Life of Sri Sri Ravi Shankar,by Bhanumathi Narasimhan,4.9,330,9386850575,293.0,Amazon
The Art Of Study,by Vijay Agarwal,4.3,17,8190702564,175.0,Amazon
The Orient Blackswan School Atlas with CD,by OBS,4.1,479,8125056866,236.0,Amazon
World Map,by Dreamland Publications,4.5,856,8184511213,91.0,Amazon
"World Atlas: Government Approved Maps of India and the World, for Exams and Competitions...",by VS Editorial Board,3.5,2,9357941495,94.0,Amazon
Longman School Atlas,by Longman,4.1,8,9332510210,286.0,Amazon
India Map,by Dreamland Publications,4.6,594,8184511523,91.0,Amazon
Disha Children's Yearbook 2018 - General Knowledge Fundamentals and Current Affairs,by Disha Experts,4.7,7,9387421007,203.0,Amazon
Our Earth (Family Reference),by NA,2.0,1,1472311310,325.0,Amazon
"The Husband's Secret: From the bestselling author of Big Little Lies, now an...",by Liane Moriarty,3.6,31,1405911662,221.0,Amazon
The Sealed Nectar: Biography of the Noble Prophet,by Safi-ur-Rahman al-Mubarkpuri,4.7,38,9960899551,485.0,Amazon
Numbercaste,by Yudhanjaya Wijeratne,4.5,2,9353023335,218.0,Amazon
The Power of your Subconscious Mind,Joseph Murphy,4.5,4977,8192910962,65.0,Amazon
"The 5 AM Club: Own Your Morning, Elevate Your Life",Robin Sharma,4.3,143,9387944891,199.0,Amazon
Think and Grow Rich,Napoleon Hill,4.6,3596,8192910911,64.0,Amazon
General Knowledge 2019,Manohar Pandey,4.2,515,9312147307,19.0,Amazon
General Knowledge,Not Available,4.4,2035,9384761540,156.0,Amazon
Word Power Made Easy,Norman Lewis,4.4,5643,8183071007,76.0,Amazon
Quantitative Aptitude for Competitive Examinations,R S Aggarwal,4.1,3310,9352534026,427.0,Amazon
The Alchemist,Paulo Coelho,4.6,3820,8172234988,182.0,Amazon
Manorama Yearbook 2019 ( English),Not Available,4.5,37,8193769716,228.0,Amazon
24 Years UPSC IAS/ IPS Prelims Topic-wise Solved Papers 1 & 2 (1995-2018),Disha Experts,4.3,220,9388026586,270.0,Amazon
How to Win Friends and Influence People,Dale Carnegie,4.5,2640,8192910997,79.0,Amazon
Attitude Is Everything: Change Your Attitude ... Change Your Life!,Jeff Keller,4.6,748,9351772071,105.0,Amazon
Lucent's General Science (2018-2019) Session,Not Available,4.1,220,9384761141,150.0,Amazon
Wings of Fire: An Autobiography of Abdul Kalam,Not Available,4.6,2131,8173711461,194.0,Amazon
The Forest of Enchantments,Chitra Banerjee Divakaruni,4.6,8,9353025982,373.0,Amazon
"Don't Lose Your Mind, Lose Your Weight",Rujuta Diwekar,4.5,1003,8184001053,118.0,Amazon
Life is What You Make It,Preeti Shenoy,4.0,2859,9380349300,75.0,Amazon
The Theory of Everything,Stephen Hawking,4.5,531,8179925919,111.0,Amazon
Oswaal CBSE Sample Question Paper Class 10 Science (For March 2019 Exam),Oswaal Editorial Board,4.3,30,9388036662,127.0,Amazon
Oswaal CBSE Sample Question Paper Class 10 Mathematics (For March 2019 Exam),Oswaal Editorial Board,4.4,42,9388036689,127.0,Amazon
CBSE Chemistry Chapterwise Solved Papers Class 12th,Not Available,4.2,97,9313161419,152.0,Amazon
CBSE Chapterwise Physics Class 12th,Not Available,4.2,87,9313161427,172.0,Amazon
1984,George Orwell,4.4,738,8192910903,88.0,Amazon
Who Will Cry When You Die?,Robin Sharma,4.4,2795,8179922324,103.0,Amazon
The Great Gatsby,F. Scott Fitzgerald,4.1,338,8172344562,47.0,Amazon
Oswaal CBSE Sample Question Paper Class 10 Social Science (For March 2019 Exam),Oswaal Editorial Board,4.6,24,9388036670,126.0,Amazon
Objective NCERT at your Fingertips - Biology,Not Available,4.7,268,9387949222,408.0,Amazon
NTA UGC NET/SET/JRF - Paper 1: Teaching and Research Aptitude by Pearson,KVS Madaan,4.4,505,9332551731,216.0,Amazon
40 Years' Chapterwise Topicwise Solved Papers (2018-1979) IIT JEE Physics,DC. Pandey,4.1,90,9313163292,191.0,Amazon
High School English Grammar and Composition Book (Regular Edition),Not Available,4.4,883,9352530144,259.0,Amazon
Fast Track Objective Arithmetic,Not Available,4.3,2876,9312149830,223.0,Amazon
"The Power of Habit: Why We Do What We Do, and How to Change",Charles Duhigg,4.4,639,1847946240,286.0,Amazon
Emotion and Relationships,Sadhguru,4.7,124,9386867508,138.0,Amazon
Rich Dad Poor Dad,Robert T. Kiyosaki,4.5,3563,8186775218,135.0,Amazon
Bharat Ki Rajvayvastha,M. Laxmikanth,4.5,673,9352603869,381.0,Amazon
40 Years' Chapterwise Topicwise Solved Papers (2018-1979) IIT JEE Mathematics,Amit M. Agarwal,4.2,91,9313163314,200.0,Amazon
The Secret,Rhonda Byrne,4.5,1605,1847370292,415.0,Amazon
40 Years Chapterwise Topicwise Solved Papers (2018-1979) IIT JEE Chemistry,Ranjeet Shahi,4.4,91,9313163306,225.0,Amazon
Oswaal CBSE Question Bank Class 10 Science Chapterwise and Topicwise (For March 2019 Exam),Not Available,4.6,184,9387504913,247.0,Amazon
Objective General English,S.P. Bakshi,4.2,1771,9351768449,154.0,Amazon
10 Last Years Solved Papers: CBSE Class 10 for 2019 Examination,Not Available,4.0,99,9387660400,357.0,Amazon
One Indian Girl,Chetan Bhagat,3.6,4929,8129142147,96.0,Amazon
How to Stop Worrying and Start Living: Time-Tested Methods for Conquering Worry,Dale Carnegie,4.5,627,8175993952,88.0,Amazon
Current Affairs Yearly  2019,Not Available,5.0,3,9313169886,124.0,Amazon
The 7 Habits of Highly Effective People,Not Available,4.0,1093,1471131823,311.0,Amazon
Mahatma Gandhi Autobiography: The Story Of My Experiments With Truth,by Mahatma Gandhi,4.4,247,8172343116,99.0,Amazon
Turning Points : A Journey Through Challanges: A Journey Through Challenges,by A.P.J. Abdul Kalam - Abridged,4.7,409,9350293471,135.0,Amazon
The Autobiography of Benjamin Franklin,by Benjamin Franklin,4.1,253,8175993286,99.0,Amazon
Grinding It Out: The Making of McDonald's,by Ray Kroc,4.5,21,1250127505,280.0,Amazon
My Journey: Transforming Dreams into Actions,by A.P.J. Abdul Kalam,4.7,587,8129124912,180.0,Amazon
Without Fear,by Kuldip Nayar,4.7,95,9350292203,170.0,Amazon
A Century is not Enough: My Roller-coaster Ride to Success,by Sourav Ganguly - Illustrated,4.6,322,9386228564,363.0,Amazon
Narendra Modi: A political Biography,by Andy Marino,4.4,92,9351770257,253.0,Amazon
Albert Einstein: A Biography,by Alice Calaprice,4.3,44,8184953542,263.0,Amazon
Touch the Sky: The inspiring stories of women from across India who are writing...,by Rashmi Bansal - Abridged,3.7,38,9386850702,109.0,Amazon
Devil's Advocate: The Untold Story,by Karan Thapar,4.1,70,9352779843,370.0,Amazon
Jerusalem: The Biography,by Simon Sebag Montefiore,4.6,17,1780220251,524.0,Amazon
My Journey,by Apj Abdul Kalam,4.6,61,8183224202,106.0,Amazon
Lone Fox Dancing: My Autobiography,by Ruskin Bond,4.8,99,9386338904,315.0,Amazon
Ronaldo - 2018 Updated Edition: The Obsession For Perfection (Luca Caioli),by Luca Caioli,5.0,9,1785782312,359.0,Amazon
The Coalition Years,by Pranab Mukherjee,3.6,39,8129149052,325.0,Amazon
Unbreakable,by Mary Kom,4.6,158,9351160092,145.0,Amazon
Pride & Prejudice,by Jane Austen,4.3,352,8172344503,79.0,Amazon
Rekha: The Untold Story,by Yasser Usman,3.7,72,8193284186,256.0,Amazon
How to Memorize Anything: The Ultimate Handbook to Enlighten and Improve Your...,by Aditi Singhal,4.4,147,8184005210,242.0,Amazon
Pathways to Greatness,by A.P.J. Abdul Kalam,4.7,13,9352643836,165.0,Amazon
Inspiring Thoughts (Inspiring Thoughts Quotation Series),by Swami Vivekanand,4.2,306,8170289262,107.0,Amazon
Meri Jeevan Yatra,by A.P.J. Abdul Kalam,4.7,146,9350487977,150.0,Amazon
Autobiography of a Yogi (Telugu),by Paramahansa Yogananda,4.7,114,8189955357,141.0,Amazon
Ivory Throne: Chronicles of the House of Travancore,by Manu S. Pillai,4.3,127,9351776425,433.0,Amazon
"Shirdi Sai Baba: Life, Philosophy & Teachings",by Satish C. Agarwal,4.1,10,8175994711,159.0,Amazon
I Tagged Her in My Heart,by Anuj Tiwari - Import,4.7,224,8129149567,100.0,Amazon
Sanjay Dutt: The Crazy Untold Story of Bollywood’s Bad Boy,by Yasser Usman,4.2,37,9386228580,293.0,Amazon
A Thousand Splendid Suns,by Khaled Hosseini,4.5,729,1408844443,374.0,Amazon
Don'T Kill Him!: The Story Of My Life With Bhagwan Rajneesh,by Ma Anand Sheela,3.6,32,8172344449,189.0,Amazon
Turning Points (Hindi),by A.P.J. Abdul Kalam,4.7,409,9350641003,160.0,Amazon
Lauhpurush Sardar Vallabhbhai Patel,by Sushil Kapoor,5.0,2,9350484080,143.0,Amazon
Bal Thackeray and the Rise of the Shiv Sena,by Vaibhav Purandare,3.7,13,8174369589,280.0,Amazon
Indira: India’s Most Powerful Prime Minister,by Sagarika Ghose,1.4,389,9386228343,508.0,Amazon
Tom Gates Book #2: Excellent Excuses Cand Other Good Stuff,by Tom Gates,4.8,76,9351033007,157.0,Amazon
Veronika Decides to Die,by Paulo Coelho,4.4,202,8172235437,186.0,Amazon
Miracles of Your Mind,by Dr. Joseph Murphy,4.2,218,8183225101,72.0,Amazon
The Leader Who Had No Title,by Robin Sharma,4.4,393,8184951191,189.0,Amazon
Tom Gates Book #3: Everythings Amazing,by Tom Gates,4.8,55,9351033015,157.0,Amazon
The Definitive Book of Body Language,by Allan Pease,4.4,137,8183220142,255.0,Amazon
The Magic,by Rhonda Byrne,4.6,602,1849838399,230.0,Amazon
Accounting and Finance for Bankers,by Med,4.5,248,9350598485,352.0,Amazon
Eclipse,by Stephenie Meyer,4.3,92,1904233910,447.0,Amazon
The Philosophy Book (Big Ideas),by DK,4.6,25,1405353295,609.0,Amazon
The Great Book of Puzzles & Teasers,by George J. Summers,4.2,68,8172242212,60.0,Amazon
My Baby Record Book,by Dreamland Publications,4.4,117,9350896540,175.0,Amazon
Prep Guide To BITSAT 2019,by Arihant Expert,4.1,19,9313163802,497.0,Amazon
The Business School,by Robert T. Kiyosaki,4.5,216,8186775811,108.0,Amazon
Before You Start Up: How to Prepare to Make Your Startup Dream a Reality,by Pankaj Goyal,4.6,32,8175994401,179.0,Amazon
Questions Are the Answers,by Allan Pease,4.4,226,8186775056,83.0,Amazon
Corporate Chanakya,by Radhakrishnan Pillai,4.2,188,8184951337,189.0,Amazon
IIMA - Day to Day Economics,by Satish Y. Deodhar,4.4,314,8184001630,173.0,Amazon
I Do What I Do,by Raghuram G. Rajan,4.3,313,9352770145,363.0,Amazon
Think and Grow Rich - the 21St-Century Edition,by Napoleon Hill,4.6,118,8183223656,185.0,Amazon
The Business of the 21St Century (Tamil),by Robert T Kiyosaki,3.8,22,8183223362,149.0,Amazon
The Dhandho Investor: The Low-Risk Value Method to High Returns,by Mohnish Pabrai,4.2,169,8126564636,196.0,Amazon
Entrepreneur 5 P.M. to 9 A.M.: Launching a Profitable Start-Up without Quitting...,by Kanth Miriyala,4.0,58,8129123932,195.0,Amazon
The Business School,by Robert Kiyosaki,4.2,18,8183221645,185.0,Amazon
The Business School,by Robert T Kiyosaki,3.8,18,8183222366,185.0,Amazon
Copycat Marketing 101,by Burke Hedges,4.2,206,8182744466,90.0,Amazon
The Business of the 21St Century,by Robert T. Kiyosaki,4.3,29,8183223664,157.0,Amazon
Business Sutra: A Very Indian Approach to Management (Old Edition),by Devdutt Pattanaik - Unabridged,4.4,110,9384067547,489.0,Amazon
"The $100 Startup: Fire Your Boss, Do What You Love and Work Better To Live More",by Chris Guillebeau,4.0,112,1447286316,239.0,Amazon
The Business of the 21St Century,by Robert T. Kiyosaki,4.1,69,8183223273,164.0,Amazon
The One Minute Manager,by Kenneth Blanchard,4.4,234,8172234996,118.0,Amazon
Sawal Hi Jawab Hai,by Allan Pease,4.3,237,8186775064,64.0,Amazon
The Big 100: The 100 Business Tools You Need to Succeed,by Jeremy Kourdi,4.8,6,1444796119,208.0,Amazon
Naye Zamane Ka Naya Business: Network Marketing,by Shanker Manshani,4.2,29,8183222692,190.0,Amazon
Questions Are the Answers,by Allan Pease,4.0,21,8183222374,84.0,Amazon
Inside the C-Suite: 21 Lessons from Top Management to Get Your Way in Business...,by Jayaram Easwaran,4.8,15,9352773691,240.0,Amazon
Business Studies Class- 11 - CBSE-2018,by Poonam Gandhi,4.9,11,9387516806,350.0,Amazon
Narrative and Numbers: The Value of Stories in Business,by Aswath Damodaran,4.7,4,9353024536,311.0,Amazon
Sochiye Aur Amir Baniye (Think and Grow Rich),by Napoleon Hill,4.2,332,8186775552,158.0,Amazon
Business Studies Class 12 - CBSE 2018,by Gandhi. Poonam,4.4,8,9387516644,375.0,Amazon
A Feast of Vultures: The Hidden Business of Democracy in India,by Josy Joseph,4.5,254,9350297515,522.0,Amazon
I have a Dream,by Rashmi Bansal,3.9,126,9380658389,187.0,Amazon
Logon ko 90 seconds Mein Kaise Prabhavit Karen,by Nicholas Boothman,4.3,21,8183226957,207.0,Amazon
Think and Grow Rich 21St Cent. Edition,by Napoleon Hill,4.4,92,8183223133,189.0,Amazon
Marketing 4.0: Moving from Traditional to Digital,by Philip Kotler,4.2,50,8126566930,298.0,Amazon
Questions Are the Answers,by Allan Pease,3.5,7,8186775447,116.0,Amazon
HBR's 10 Must Reads: On Leadership (Harvard Business Review Must Reads),by HBR,4.8,14,1422157970,600.0,Amazon
Retire Young Retire Rich,by Robert T. Kiyosaki,4.3,45,8183221459,344.0,Amazon
Hum Apko Ameer Kyon Banana Chahte Hain ( Why We Want You to Be Rich  in Hindi),by Robert T. Kiyosaki,3.9,15,8183220908,333.0,Amazon
Connect the Dots,by Rashmi Bansal,4.3,344,9381626707,197.0,Amazon
Corporate Chanakya on Leadership (With CD),by Radhakrishnan Pillai,4.4,27,8184953070,284.0,Amazon
Corporate Guru Dhirubhai Ambani,by Prateeksha M. Tiwari,3.3,18,8128824287,101.0,Amazon
CBSE Chapterwise Solved Paper Business Studies Class 12 for 2018-2019,by Arihant Expert,3.7,18,9313161443,110.0,Amazon
The Essential Collection for Young Readers,by Ruskin Bond,4.2,29,8129137003,195.0,Amazon
Lovely Board Books: Gift Pack (Set of 10 Books),by Dreamland Publications,4.3,711,8184511590,455.0,Amazon
The Vedas and Upanishads for Children,by Roopa Pai,3.0,2,9351952967,238.0,Amazon
Goodnight Moon,by Margaret Wise Brown,3.9,190,1509829466,107.0,Amazon
365 Pancharantra Stories,by OM Books,4.1,180,8187107588,357.0,Amazon
The Blue Umbrella,by Ruskin Bond,4.4,348,8129124548,97.0,Amazon
Baby touch: Peekaboo,by Lemon Ribbon Studio,4.3,596,1409300498,230.0,Amazon
The Book of Children: Supporting the Freedom and Intelligence of a New Generation...,by Osho,4.6,35,1250006201,298.0,Amazon
Children's Encyclopedia - The World of Knowledge: Familiarising Children with...,by V&S Editorial Board,4.0,112,9350571099,643.0,Amazon
Student's Encyclopedia of General Knowledge (General Press),by Azeem Ahmad Khan,4.1,189,9380914199,131.0,Amazon
A Complete Resource for CTET: Child Development and Pedagogy,by Sandeep Kumar,3.9,67,9332541302,125.0,Amazon
Jane Eyre,by Charlotte Bronte,4.3,183,8193387619,88.0,Amazon
Metamorphosis,by Franz Kafka,4.2,198,8172345135,69.0,Amazon
Three Men in a Boat,by Jerome K. Jerome,4.3,201,8172344430,99.0,Amazon
Macbeth,by William Shakespeare,4.3,89,8175994193,99.0,Amazon
The Greatest Short Stories of Leo Tolstoy,by Leo Tolstoy,4.5,173,8184950314,189.0,Amazon
Mrs. Dalloway,by Virginia Woolf,4.2,33,8175994215,99.0,Amazon
The Origin of Species,by Charles Darwin,4.3,214,8172344880,189.0,Amazon
Tantri the Mantri - 4,by Rajani Thindiath,4.0,7,9350853701,76.0,Amazon
Bāhubali: Battle of the Bold,by Graphic India,3.7,55,9386224658,95.0,Amazon
Geronimo Stilton #64: The Magical Mission,by Geronimo Stilton,4.4,91,9386106256,272.0,Amazon
Objective Computer Awareness,by Arihant Experts,4.0,171,9311121266,78.0,Amazon
A Handbook on Computer Science & IT - Illustrated Formulae & Key Theory Concepts,by Made Easy Editorial Board,4.0,180,9383643242,247.0,Amazon
Handbook of Computer Science & IT,by Surbhi Mitra,3.9,193,9350944308,190.0,Amazon
CCC (Course on Computer Concepts) Study Guide,by Arihant Experts,4.3,44,9311124559,147.0,Amazon
Computer Knowledge for SBI/IBPS Clerk/PO/RRB/RBI/SSC... Exams,by Shikha Agarwal,3.5,46,9386320177,93.0,Amazon
19 years GATE Computer Science & Information Technology Chapter-wise & Topic-wise...,by Disha Experts,3.8,5,9388026764,175.0,Amazon
Computer System Architecture 3e (Update) by Pearson,by Mano M Morris,4.3,102,9332585601,446.0,Amazon
CBSE Computer Science Chapterwise Solved Papers  Class 12 for 2018-2019,by Arihant Expert,4.4,27,9313161486,232.0,Amazon
CBSE All  In One Computer Science CBSE Class 12 for 2018 - 19,by K. Ganesh Ayyer,4.2,19,9312149091,232.0,Amazon
"Computer Networks, 5e (5th Edition)",by Tanenbaum,4.2,61,9332518742,493.0,Amazon
CCC (Course on Computer Concepts),by Arihant Experts,3.8,41,9311124567,94.0,Amazon
Oswaal ICSE Question Bank Class 10 Computer Application Chapterwise and Topicwise...,by Oswaal Editorial Board,3.7,11,9387504743,75.0,Amazon
Super Speed Computer Course,by Shashank Johari,3.9,12,8173158762,250.0,Amazon
Comdex Hardware and Networking Course Kit: Revised & Upgraded,by Vikas Gupta,4.0,16,9351192652,379.0,Amazon
Object-Oriented Programming with C++,by E Balagurusamy,4.5,73,9352607996,371.0,Amazon
Programming and Problem Solving with Python,by Ashok Namdev Kamthane,4.8,6,9387067572,519.0,Amazon
Oswaal CBSE Question Bank Class 10 Social Science Chapterwise and Topicwise (...,by Oswaal Editorial Board,4.7,167,9387504921,320.0,Amazon
Olympiad Champs Cyber Class 1 with Past Olympiad Questions,by Disha Experts,5.0,1,9388240278,90.0,Amazon
"Computer Fundamentals, 1e",by Goel,4.2,43,8131733092,349.0,Amazon
Electronics and Communication Engineering GATE 2019,by Ankit Goel,4.1,14,9312148222,669.0,Amazon
Brain Games for Clever Kids (Buster Brain Games),by Gareth Moore,4.6,37,1780552491,188.0,Amazon
The Perfect Murder,by Ruskin Bond - Import,3.8,56,8129144972,195.0,Amazon
3 and a Half Murders: An Inspector Saralkar Mystery,by Salil Desai,4.4,69,8175994258,189.0,Amazon
I Am Watching You,by Teresa Driscoll,4.0,46,1542046599,269.0,Amazon
Born a Crime: Stories from a South African Childhood,by Trevor Noah,4.8,143,1473635306,388.0,Amazon
The Other Side of Midnight,by Sidney Sheldon,4.3,53,8172234937,209.0,Amazon
Nothing Lasts Forever,by Sidney Sheldon,4.2,84,8172234856,266.0,Amazon
Harry Potter and the Goblet of Fire (Harry Potter 4),by J.K. Rowling,4.7,322,1408855682,524.0,Amazon
Peaks and Valleys,by Spencer Johnson,4.4,28,1847396488,109.0,Amazon
Attitude Is Everything (Pentagon Press),by Jeff Keller,4.3,40,8182747252,166.0,Amazon
Dork Diaries Frenemies Forever,by Rachel Renee Russell,4.6,70,1471158039,182.0,Amazon
Dork Diaries: Holiday Heartbreak,by Rachel Renee Russell - Import,4.8,45,1471144771,254.0,Amazon
Dork Diaries,by Rachel Renee Russell,4.6,49,1471168018,202.0,Amazon
Dork Diaries: TV Star,by Rachel Renee Russell - Import,4.8,37,1471143953,308.0,Amazon
"Understanding Exposure, Fourth Edition",by BRYAN PETERSON,4.5,48,1607748509,633.0,Amazon
The Digital Photography Handbook: An Illustrated Step-by-step Guide,by Doug Harman - Import,4.0,1,1786481324,437.0,Amazon
"Big Data: A Revolution That Will Transform How We Live, Work and Think",by Viktor Mayer-Schonberger,3.8,57,1848547927,255.0,Amazon
Photography: The Definitive Visual History,by Tom Ang,5.0,2,1409346455,1.0,Amazon
Stretch Your Technology Email,by Ankit Fadia,4.1,14,9385152459,77.0,Amazon
Digital Photography for Beginners: Photography Essentials Basics Lessons Course...,by Angela Pierce,1.0,5,1681858711,349.0,Amazon
Valley of Genius,by Adam Fisher,5.0,2,1538714493,510.0,Amazon
So You Want to Know About Economics,by Roopa Pai - Import,4.7,65,8129145197,195.0,Amazon
Fault Lines : How Hidden Fractures Still Threaten The World Economy,by Raghuram Rajan,4.7,139,9350291738,421.0,Amazon
UGC NET Economics,by Sunder Gopal Mishra,4.2,14,9312146440,469.0,Amazon
15 Sample Question Papers Economics Class 12th CBSE,by Arihant Experts,4.5,2,9313166046,200.0,Amazon
CBSE All  In One Economics Class 11 for 2018 - 19,by Arihant Experts,3.6,17,9312148389,264.0,Amazon
CBSE Chapterwise Solved Papers Economics Class 12 for 2018-2019,by Arihant Expert,4.3,17,9313161451,159.0,Amazon
15 Sample Question Papers Economic Class 11th CBSE,by Arihant Expert,3.0,1,9313166208,109.0,Amazon
KVS PGT Self Preparation Guide Economics Recruitment Examination,by Arihant Experts,3.3,3,9312144960,228.0,Amazon
CBSE All  In One Economics CBSE Class 12 for 2018 - 19,by Arihant Experts,3.8,32,9312149083,210.0,Amazon
